{
  "schemaVersion": "1.0.0-draft",
  "mediaType": "application/vnd.agentsuite.tool.v1+json",
  "id": "search",
  "version": "1.0.0",
  "retained": true,
  "provider": {
    "protocol": "mcp",
    "revision": "2025-06-18",
    "operations": [
      {
        "name": "search",
        "description": "Search the configured remote data source.",
        "inputSchema": {
          "path": "schemas/search-input.json",
          "digest": "sha256:25f52652219a4e1e8581e76db1955df62b26a1174a2612eb12538b3efa9d8c84"
        },
        "outputSchema": {
          "path": "schemas/search-output.json",
          "digest": "sha256:5d694e1c4645dbba200792defc1de3ee4956e519657e4e581ee770dd6f5fb203"
        },
        "effects": [
          "remote-read"
        ]
      }
    ]
  },
  "remote": {
    "transport": "streamable-http",
    "endpointRef": "search-mcp-endpoint",
    "headers": [
      {
        "name": "Authorization",
        "secretRef": {
          "name": "search-mcp-auth",
          "key": "token"
        }
      }
    ],
    "network": [
      {
        "destinationRef": "search-mcp-egress"
      }
    ],
    "timeouts": {
      "connectMilliseconds": 5000,
      "requestMilliseconds": 60000
    },
    "cancellation": "propagate",
    "connection": "session-aware"
  },
  "extensions": []
}
